{
  "schemaVersion": 1,
  "id": "statusGlass",
  "segmentCount": 17,
  "viewWidth": 80,
  "viewHeight": 24,
  "shapes": [
    {
      "id": 16,
      "polygon": [
        {
          "x": 2,
          "y": 2
        },
        {
          "x": 14,
          "y": 2
        },
        {
          "x": 14,
          "y": 20
        },
        {
          "x": 2,
          "y": 20
        }
      ]
    },
    {
      "id": 3,
      "polygon": [
        {
          "x": 22,
          "y": 2
        },
        {
          "x": 34,
          "y": 2
        },
        {
          "x": 34,
          "y": 20
        },
        {
          "x": 22,
          "y": 20
        }
      ]
    },
    {
      "id": 9,
      "polygon": [
        {
          "x": 42,
          "y": 2
        },
        {
          "x": 54,
          "y": 2
        },
        {
          "x": 54,
          "y": 20
        },
        {
          "x": 42,
          "y": 20
        }
      ]
    },
    {
      "id": 0,
      "polygon": [
        {
          "x": 62,
          "y": 2
        },
        {
          "x": 74,
          "y": 2
        },
        {
          "x": 74,
          "y": 20
        },
        {
          "x": 62,
          "y": 20
        }
      ]
    }
  ],
  "icons": [
    {
      "id": "ready",
      "segments": [
        16,
        3
      ]
    },
    {
      "id": "piece",
      "segments": [
        9
      ]
    }
  ],
  "groups": [
    {
      "id": "level",
      "segments": [
        9,
        0
      ],
      "maximum": 3
    }
  ],
  "texts": [],
  "numbers": []
}
